{
  "assessed_at": "2026-09-08T18:30:00+00:00",
  "assessment_id": "gokv_0_3_promotion_assessment_post_first_institutional_promotion",
  "category_counts": {
    "DIRECTION_APPROVAL_REQUIRED": 1,
    "INSUFFICIENT_EVIDENCE": 8
  },
  "decisions": [
    {
      "assessed_at": "2026-09-08T00:00:00+00:00",
      "blockers": [
        "requires_independent_source_commits",
        "requires_multiple_evidence_refs",
        "requires_repeated_source_checkpoints"
      ],
      "confidence_after": "HIGH",
      "confidence_before": "HIGH",
      "criteria": {
        "absence_of_known_contradiction": true,
        "applicability_declared": true,
        "confidence_high": true,
        "contract_compatible": true,
        "exceptions_reviewed": true,
        "freshness_current": true,
        "independent_source_commits": false,
        "multiple_evidence": false,
        "repeated_execution": false,
        "reversible": true,
        "scope_declared": true,
        "source_quality_declared": true
      },
      "evidence_after": 1,
      "evidence_before": 1,
      "evidence_count": 1,
      "evidence_kinds": [
        "checkpoint"
      ],
      "evidence_overlay_ref": null,
      "knowledge_id": "already_compliant_do_not_invent_change",
      "learning_origin": "DEVELOPMENT_ORIGIN",
      "promotion_readiness": "INSUFFICIENT_EVIDENCE",
      "readiness_after": "INSUFFICIENT_EVIDENCE",
      "readiness_before": "INSUFFICIENT_EVIDENCE",
      "reasoning_summary": "The item is validated for its current checkpoint but lacks the independent repeated evidence required for promotion.",
      "recommendation": "collect repeated independent evidence and reassess",
      "risk": "HIGH",
      "source_checkpoint_count": 1,
      "source_checkpoint_count_after": 1,
      "source_checkpoint_count_before": 1,
      "source_commit_count": 1,
      "source_commit_count_after": 1,
      "source_commit_count_before": 1,
      "status": "VALIDATED"
    },
    {
      "assessed_at": "2026-09-08T00:00:00+00:00",
      "blockers": [
        "requires_multiple_evidence_refs",
        "requires_repeated_source_checkpoints"
      ],
      "confidence_after": "HIGH",
      "confidence_before": "HIGH",
      "criteria": {
        "absence_of_known_contradiction": true,
        "applicability_declared": true,
        "confidence_high": true,
        "contract_compatible": true,
        "exceptions_reviewed": true,
        "freshness_current": true,
        "independent_source_commits": true,
        "multiple_evidence": false,
        "repeated_execution": false,
        "reversible": true,
        "scope_declared": true,
        "source_quality_declared": true
      },
      "evidence_after": 1,
      "evidence_before": 1,
      "evidence_count": 1,
      "evidence_kinds": [
        "document"
      ],
      "evidence_overlay_ref": null,
      "knowledge_id": "compile_human_decisions_into_packages",
      "learning_origin": "DEVELOPMENT_ORIGIN",
      "promotion_readiness": "INSUFFICIENT_EVIDENCE",
      "readiness_after": "INSUFFICIENT_EVIDENCE",
      "readiness_before": "INSUFFICIENT_EVIDENCE",
      "reasoning_summary": "The item is validated for its current checkpoint but lacks the independent repeated evidence required for promotion.",
      "recommendation": "collect repeated independent evidence and reassess",
      "risk": "MEDIUM",
      "source_checkpoint_count": 1,
      "source_checkpoint_count_after": 1,
      "source_checkpoint_count_before": 1,
      "source_commit_count": 2,
      "source_commit_count_after": 2,
      "source_commit_count_before": 2,
      "status": "VALIDATED"
    },
    {
      "assessed_at": "2026-09-08T00:00:00+00:00",
      "blockers": [
        "institutional_direction_required_for_this_kind"
      ],
      "confidence_after": "HIGH",
      "confidence_before": "HIGH",
      "criteria": {
        "absence_of_known_contradiction": true,
        "applicability_declared": true,
        "confidence_high": true,
        "contract_compatible": true,
        "exceptions_reviewed": true,
        "freshness_current": true,
        "independent_source_commits": true,
        "multiple_evidence": true,
        "repeated_execution": true,
        "reversible": true,
        "scope_declared": true,
        "source_quality_declared": true
      },
      "evidence_after": 2,
      "evidence_before": 1,
      "evidence_count": 2,
      "evidence_kinds": [
        "document"
      ],
      "evidence_overlay_ref": "conditioned_autonomy_ui_ux_1_200_0_3",
      "knowledge_id": "conditioned_autonomy",
      "learning_origin": "DEVELOPMENT_ORIGIN",
      "promotion_readiness": "DIRECTION_APPROVAL_REQUIRED",
      "readiness_after": "DIRECTION_APPROVAL_REQUIRED",
      "readiness_before": "INSUFFICIENT_EVIDENCE",
      "reasoning_summary": "Evidence is sufficient for a policy review, but this kind changes institutional autonomy, model, cost, or architecture direction.",
      "recommendation": "request explicit direction review; do not promote automatically",
      "risk": "HIGH",
      "source_checkpoint_count": 2,
      "source_checkpoint_count_after": 2,
      "source_checkpoint_count_before": 1,
      "source_commit_count": 5,
      "source_commit_count_after": 5,
      "source_commit_count_before": 2,
      "status": "VALIDATED"
    },
    {
      "assessed_at": "2026-09-08T00:00:00+00:00",
      "blockers": [
        "requires_multiple_evidence_refs"
      ],
      "confidence_after": "HIGH",
      "confidence_before": "HIGH",
      "criteria": {
        "absence_of_known_contradiction": true,
        "applicability_declared": true,
        "confidence_high": true,
        "contract_compatible": true,
        "exceptions_reviewed": true,
        "freshness_current": true,
        "independent_source_commits": true,
        "multiple_evidence": false,
        "repeated_execution": true,
        "reversible": true,
        "scope_declared": true,
        "source_quality_declared": true
      },
      "evidence_after": 1,
      "evidence_before": 1,
      "evidence_count": 1,
      "evidence_kinds": [
        "document"
      ],
      "evidence_overlay_ref": null,
      "knowledge_id": "contract_over_ui_inference",
      "learning_origin": "DEVELOPMENT_ORIGIN",
      "promotion_readiness": "INSUFFICIENT_EVIDENCE",
      "readiness_after": "INSUFFICIENT_EVIDENCE",
      "readiness_before": "INSUFFICIENT_EVIDENCE",
      "reasoning_summary": "The item is validated for its current checkpoint but lacks the independent repeated evidence required for promotion.",
      "recommendation": "collect repeated independent evidence and reassess",
      "risk": "HIGH",
      "source_checkpoint_count": 2,
      "source_checkpoint_count_after": 2,
      "source_checkpoint_count_before": 2,
      "source_commit_count": 2,
      "source_commit_count_after": 2,
      "source_commit_count_before": 2,
      "status": "VALIDATED"
    },
    {
      "assessed_at": "2026-09-08T00:00:00+00:00",
      "blockers": [
        "requires_multiple_evidence_refs",
        "requires_repeated_source_checkpoints"
      ],
      "confidence_after": "HIGH",
      "confidence_before": "HIGH",
      "criteria": {
        "absence_of_known_contradiction": true,
        "applicability_declared": true,
        "confidence_high": true,
        "contract_compatible": true,
        "exceptions_reviewed": true,
        "freshness_current": true,
        "independent_source_commits": true,
        "multiple_evidence": false,
        "repeated_execution": false,
        "reversible": true,
        "scope_declared": true,
        "source_quality_declared": true
      },
      "evidence_after": 1,
      "evidence_before": 1,
      "evidence_count": 1,
      "evidence_kinds": [
        "checkpoint"
      ],
      "evidence_overlay_ref": null,
      "knowledge_id": "controlled_assembled_block_execution",
      "learning_origin": "DEVELOPMENT_ORIGIN",
      "promotion_readiness": "INSUFFICIENT_EVIDENCE",
      "readiness_after": "INSUFFICIENT_EVIDENCE",
      "readiness_before": "INSUFFICIENT_EVIDENCE",
      "reasoning_summary": "The item is validated for its current checkpoint but lacks the independent repeated evidence required for promotion.",
      "recommendation": "collect repeated independent evidence and reassess",
      "risk": "MEDIUM",
      "source_checkpoint_count": 1,
      "source_checkpoint_count_after": 1,
      "source_checkpoint_count_before": 1,
      "source_commit_count": 2,
      "source_commit_count_after": 2,
      "source_commit_count_before": 2,
      "status": "VALIDATED"
    },
    {
      "assessed_at": "2026-09-08T00:00:00+00:00",
      "blockers": [
        "requires_multiple_evidence_refs"
      ],
      "confidence_after": "HIGH",
      "confidence_before": "HIGH",
      "criteria": {
        "absence_of_known_contradiction": true,
        "applicability_declared": true,
        "confidence_high": true,
        "contract_compatible": true,
        "exceptions_reviewed": true,
        "freshness_current": true,
        "independent_source_commits": true,
        "multiple_evidence": false,
        "repeated_execution": true,
        "reversible": true,
        "scope_declared": true,
        "source_quality_declared": true
      },
      "evidence_after": 1,
      "evidence_before": 1,
      "evidence_count": 1,
      "evidence_kinds": [
        "test"
      ],
      "evidence_overlay_ref": null,
      "knowledge_id": "internal_gates",
      "learning_origin": "DEVELOPMENT_ORIGIN",
      "promotion_readiness": "INSUFFICIENT_EVIDENCE",
      "readiness_after": "INSUFFICIENT_EVIDENCE",
      "readiness_before": "INSUFFICIENT_EVIDENCE",
      "reasoning_summary": "The item is validated for its current checkpoint but lacks the independent repeated evidence required for promotion.",
      "recommendation": "collect repeated independent evidence and reassess",
      "risk": "HIGH",
      "source_checkpoint_count": 2,